id,name,description,category_id,created_at,updated_at,is_active
1,Điện thoại Android,Các dòng điện thoại sử dụng hệ điều hành Android,1,2024-01-05 09:00:00,2024-06-05 10:00:00,True
2,iPhone,Các dòng điện thoại iPhone của Apple,1,2024-01-06 09:00:00,2024-06-06 10:00:00,True
3,Laptop văn phòng,Laptop phù hợp cho công việc văn phòng,2,2024-01-07 09:00:00,2024-06-07 10:00:00,True
4,Laptop gaming,Laptop cấu hình cao dành cho chơi game,2,2024-01-08 09:00:00,2024-06-08 10:00:00,True
5,Tai nghe Bluetooth,Tai nghe không dây kết nối Bluetooth,3,2024-01-09 09:00:00,2024-06-09 10:00:00,True
6,Chuột máy tính,Chuột không dây và có dây cho máy tính,3,2024-01-10 09:00:00,2024-06-10 10:00:00,True
7,Đồng hồ thông minh,Thiết bị đeo tay thông minh,4,2024-01-11 09:00:00,2024-06-11 10:00:00,True
8,Thiết bị nhà thông minh,"Cảm biến, công tắc, camera,...",4,2024-01-12 09:00:00,2024-06-12 10:00:00,True
